{
  "$schema": "https://json-schema.org/draft/2020-12/schema",
  "$id": "https://getmaipai.github.io/shared/spec/schemas/data-class.schema.json",
  "title": "DataClass",
  "description": "One declaration of a class of data a product keeps on a person's machine: a folder whose contents share one owner, one size and access profile, one durability need and one rule for what happens when it is missing (home docs/dev.md, 'DATA-LOCATION'). Each class has exactly one location, chosen at install and movable later, so every consumer (the path resolver, the installer, the Storage page, the mover, the describe-before-delete step, the backup) reads the same declaration. This schema is the shape only: each product declares its own list (Home's is backend/src/lib/dataClasses.ts, the Stack's is served at GET /stack/v1/storage/classes) and commons never holds a product's layout. Enum values follow the design record exactly. A hold-class declaration carries an empty degrades list. A class with no capability requirement carries an empty needs list.",
  "type": "object",
  "additionalProperties": false,
  "required": [
    "id",
    "product",
    "title",
    "help",
    "level",
    "default",
    "holds",
    "size",
    "access",
    "durability",
    "rebuild",
    "sensitive",
    "needs",
    "whenMissing",
    "degrades",
    "move",
    "refetch",
    "backup"
  ],
  "properties": {
    "id": {
      "type": "string",
      "pattern": "^[a-z][a-z0-9]*(-[a-z0-9]+)*$",
      "description": "The class's stable name, lowercase words joined by hyphens (records, people-files, stack-models). It is the key in a location record's classes object and the class field of a folder marker, and is never reused for a different kind of data."
    },
    "product": {
      "type": "string",
      "enum": ["home", "stack", "bot"],
      "description": "The product that owns the class and its location record. No folder is ever shared between products."
    },
    "title": {
      "type": "string",
      "minLength": 1,
      "description": "The plain name a person sees on the Storage page and in the installer ('AI models', 'Household records')."
    },
    "help": {
      "type": "string",
      "minLength": 1,
      "description": "One or two plain sentences saying what lives here and why a person might place it apart from the rest."
    },
    "level": {
      "type": "string",
      "enum": ["basic", "advanced", "expert"],
      "description": "The disclosure level of the class's row on the Storage page (the same three levels as a setting): basic rows are shown, advanced rows are folded, expert rows sit under Developer tools."
    },
    "default": {
      "type": "object",
      "additionalProperties": false,
      "required": ["base", "subpath"],
      "description": "Where the class lives when its record entry has no override: the base folder joined with the subpath. Every default equals the layout the product had before locations existed, so adopting an existing install moves no file.",
      "properties": {
        "base": {
          "type": "string",
          "enum": ["root", "beside-root"],
          "description": "root: under the record's root path. beside-root: under the root path's parent, as the two backup classes are today, so moving the root never shifts them."
        },
        "subpath": {
          "type": "string",
          "pattern": "^(?:(?:[^/\\\\:.][^/\\\\:]*|\\.[^/\\\\:.][^/\\\\:]*|\\.\\.[^/\\\\:]+)(?:/(?:[^/\\\\:.][^/\\\\:]*|\\.[^/\\\\:.][^/\\\\:]*|\\.\\.[^/\\\\:]+))*)?$",
          "description": "A relative path of forward-slash-separated names, joined to the base. The empty string means the base folder itself (records lives in the root itself). It never starts with a slash, never contains a backslash or a colon, and never has a '.' or '..' segment, so no default can leave its base."
        }
      }
    },
    "holds": {
      "type": "string",
      "minLength": 1,
      "description": "What the folder holds, in the words the describe step and the Storage page show (file and folder names, one line)."
    },
    "size": {
      "type": "string",
      "minLength": 1,
      "description": "The size profile as prose a person can read ('MB to a few GB', '4 to 40 GB each', 'grows with retention'). The number the placement check enforces is largestFileBytes."
    },
    "access": {
      "type": "string",
      "minLength": 1,
      "description": "The access profile as prose ('small random writes, fsync on every commit', 'written once, read at boot'). It is why a slow or network disk suits one class and not another."
    },
    "durability": {
      "type": "string",
      "enum": ["irreplaceable", "rebuildable", "disposable"],
      "description": "What losing the folder costs. irreplaceable: the household's own data, gone without a backup. rebuildable: recoverable, but only by downloading or recomputing something costly. disposable: rebuilt for free."
    },
    "rebuild": {
      "type": "string",
      "enum": ["none", "download", "recompute", "empty"],
      "description": "How a lost folder is made whole. none: it cannot be. download: fetched again from its pinned source. recompute: derived again from another class. empty: it simply starts empty."
    },
    "sensitive": {
      "type": "string",
      "enum": ["none", "personal", "biometric", "keys"],
      "description": "The most sensitive thing the folder can hold, one value, strongest wins in the order none, personal, biometric, keys. The describe step names these classes by name and the placement check warns about the wrong disk for them. What else the class holds is in its holds text."
    },
    "needs": {
      "type": "array",
      "items": {
        "type": "string",
        "enum": ["sqlite", "private", "exec", "large-files", "symlinks", "hardlinks"]
      },
      "description": "The filesystem capabilities the class requires of its location, probed at the target. sqlite: reliable fsync and byte-range locks. private: owner-only permissions the filesystem enforces. exec: a mount that allows executing files. large-files: files over 4 GB. symlinks and hardlinks: as named. Empty when the class needs nothing beyond writing."
    },
    "whenMissing": {
      "type": "string",
      "enum": ["hold", "degrade"],
      "description": "What a boot does when the class's folder is absent or its marker does not match. hold: the product refuses to run (hold mode) and never creates or replaces the folder. degrade: the product runs with this class's features off and a health item raised."
    },
    "degrades": {
      "type": "array",
      "items": { "type": "string", "minLength": 1 },
      "description": "The feature codes turned off while a degrade class is missing. Empty for a hold class, which turns the whole product off instead."
    },
    "move": {
      "type": "string",
      "enum": ["offline", "online", "empty"],
      "description": "How a move of the class runs. offline: the product stops for the move. online: the product stays up and pauses only the class's own users. empty: nothing is copied, the target starts empty. Starting empty and downloading again is the separate refetch flag, chosen per move."
    },
    "refetch": {
      "type": "boolean",
      "description": "True when a move may skip the copy: the target starts empty and the product downloads the pinned set into it after the switch ('download again instead of copying')."
    },
    "backup": {
      "type": "string",
      "enum": ["hot", "cold", "exclude", "library", "kit", "none"],
      "description": "How the class enters the household backup. hot: copied into every archive. cold: copied on a slower cadence. exclude: never in the archive. library: listed in the archive, not copied. kit: only in the emergency kit, never in the archive. none: not applicable (the backup classes themselves)."
    },
    "largestFileBytes": {
      "type": "integer",
      "minimum": 0,
      "description": "The size in bytes of the largest single file the class is expected to hold, read from pinned sizes, so the placement check can refuse a filesystem with a smaller file limit. Omitted when the class holds no file near a filesystem limit."
    }
  }
}
